cve,desc
CVE-2016-6289,"Integer overflow in the virtual_file_ex function in TSRM/tsrm_virtual_cwd.c in PHP before 5.5.38, 5.6.x before 5.6.24, and 7.x before 7.0.9 allows remote attackers to cause a denial of service (stack-based buffer overflow) or possibly have unspecified other impact via a crafted extract operation on a ZIP archive."
CVE-2016-6290,"ext/session/session.c in PHP before 5.5.38, 5.6.x before 5.6.24, and 7.x before 7.0.9 does not properly maintain a certain hash data structure, which allows remote attackers to cause a denial of service (use-after-free) or possibly have unspecified other impact via vectors related to session deserialization."
CVE-2016-6291,"The exif_process_IFD_in_MAKERNOTE function in ext/exif/exif.c in PHP before 5.5.38, 5.6.x before 5.6.24, and 7.x before 7.0.9 allows remote attackers to cause a denial of service (out-of-bounds array access and memory corruption), obtain sensitive information from process memory, or possibly have unspecified other impact via a crafted JPEG image."
CVE-2016-6292,"The exif_process_user_comment function in ext/exif/exif.c in PHP before 5.5.38, 5.6.x before 5.6.24, and 7.x before 7.0.9 allows remote attackers to cause a denial of service (NULL pointer dereference and application crash) via a crafted JPEG image."
CVE-2016-6293,"The uloc_acceptLanguageFromHTTP function in common/uloc.cpp in International Components for Unicode (ICU) through 57.1 for C/C++ does not ensure that there is a '\0' character at the end of a certain temporary array, which allows remote attackers to cause a denial of service (out-of-bounds read) or possibly have unspecified other impact via a call with a long httpAcceptLanguage argument."
CVE-2016-6294,"The locale_accept_from_http function in ext/intl/locale/locale_methods.c in PHP before 5.5.38, 5.6.x before 5.6.24, and 7.x before 7.0.9 does not properly restrict calls to the ICU uloc_acceptLanguageFromHTTP function, which allows remote attackers to cause a denial of service (out-of-bounds read) or possibly have unspecified other impact via a call with a long argument."
CVE-2016-6295,"ext/snmp/snmp.c in PHP before 5.5.38, 5.6.x before 5.6.24, and 7.x before 7.0.9 improperly interacts with the unserialize implementation and garbage collection, which allows remote attackers to cause a denial of service (use-after-free and application crash) or possibly have unspecified other impact via crafted serialized data, a related issue to CVE-2016-5773."
CVE-2016-6296,"Integer signedness error in the simplestring_addn function in simplestring.c in xmlrpc-epi through 0.54.2, as used in PHP before 5.5.38, 5.6.x before 5.6.24, and 7.x before 7.0.9, allows remote attackers to cause a denial of service (heap-based buffer overflow) or possibly have unspecified other impact via a long first argument to the PHP xmlrpc_encode_request function."
CVE-2016-6297,"Integer overflow in the php_stream_zip_opener function in ext/zip/zip_stream.c in PHP before 5.5.38, 5.6.x before 5.6.24, and 7.x before 7.0.9 allows remote attackers to cause a denial of service (stack-based buffer overflow) or possibly have unspecified other impact via a crafted zip:// URL."
CVE-2016-7124,"ext/standard/var_unserializer.c in PHP before 5.6.25 and 7.x before 7.0.10 mishandles certain invalid objects, which allows remote attackers to cause a denial of service or possibly have unspecified other impact via crafted serialized data that leads to a (1) __destruct call or (2) magic method call."
CVE-2016-7125,"ext/session/session.c in PHP before 5.6.25 and 7.x before 7.0.10 skips invalid session names in a way that triggers incorrect parsing, which allows remote attackers to inject arbitrary-type session data by leveraging control of a session name, as demonstrated by object injection."
CVE-2016-7126,"The imagetruecolortopalette function in ext/gd/gd.c in PHP before 5.6.25 and 7.x before 7.0.10 does not properly validate the number of colors, which allows remote attackers to cause a denial of service (select_colors allocation error and out-of-bounds write) or possibly have unspecified other impact via a large value in the third argument."
CVE-2016-7127,"The imagegammacorrect function in ext/gd/gd.c in PHP before 5.6.25 and 7.x before 7.0.10 does not properly validate gamma values, which allows remote attackers to cause a denial of service (out-of-bounds write) or possibly have unspecified other impact by providing different signs for the second and third arguments."
CVE-2016-7128,"The exif_process_IFD_in_TIFF function in ext/exif/exif.c in PHP before 5.6.25 and 7.x before 7.0.10 mishandles the case of a thumbnail offset that exceeds the file size, which allows remote attackers to obtain sensitive information from process memory via a crafted TIFF image."
CVE-2016-7129,"The php_wddx_process_data function in ext/wddx/wddx.c in PHP before 5.6.25 and 7.x before 7.0.10 allows remote attackers to cause a denial of service (segmentation fault) or possibly have unspecified other impact via an invalid ISO 8601 time value, as demonstrated by a wddx_deserialize call that mishandles a dateTime element in a wddxPacket XML document."
CVE-2016-7130,"The php_wddx_pop_element function in ext/wddx/wddx.c in PHP before 5.6.25 and 7.x before 7.0.10 allows remote attackers to cause a denial of service (NULL pointer dereference and application crash) or possibly have unspecified other impact via an invalid base64 binary value, as demonstrated by a wddx_deserialize call that mishandles a binary element in a wddxPacket XML document."
CVE-2016-7131,"ext/wddx/wddx.c in PHP before 5.6.25 and 7.x before 7.0.10 allows remote attackers to cause a denial of service (NULL pointer dereference and application crash) or possibly have unspecified other impact via a malformed wddxPacket XML document that is mishandled in a wddx_deserialize call, as demonstrated by a tag that lacks a < (less than) character."
CVE-2016-7132,"ext/wddx/wddx.c in PHP before 5.6.25 and 7.x before 7.0.10 allows remote attackers to cause a denial of service (NULL pointer dereference and application crash) or possibly have unspecified other impact via an invalid wddxPacket XML document that is mishandled in a wddx_deserialize call, as demonstrated by a stray element inside a boolean element, leading to incorrect pop processing."
CVE-2016-7133,"Zend/zend_alloc.c in PHP 7.x before 7.0.10, when open_basedir is enabled, mishandles huge realloc operations, which allows remote attackers to cause a denial of service (integer overflow) or possibly have unspecified other impact via a long pathname."
CVE-2016-7134,"ext/curl/interface.c in PHP 7.x before 7.0.10 does not work around a libcurl integer overflow, which allows remote attackers to cause a denial of service (allocation error and heap-based buffer overflow) or possibly have unspecified other impact via a long string that is mishandled in a curl_escape call."
CVE-2016-7411,"ext/standard/var_unserializer.re in PHP before 5.6.26 mishandles object-deserialization failures, which allows remote attackers to cause a denial of service (memory corruption) or possibly have unspecified other impact via an unserialize call that references a partially constructed object."
CVE-2016-7412,"ext/mysqlnd/mysqlnd_wireprotocol.c in PHP before 5.6.26 and 7.x before 7.0.11 does not verify that a BIT field has the UNSIGNED_FLAG flag, which allows remote MySQL servers to cause a denial of service (heap-based buffer overflow) or possibly have unspecified other impact via crafted field metadata."
CVE-2016-7413,"Use-after-free vulnerability in the wddx_stack_destroy function in ext/wddx/wddx.c in PHP before 5.6.26 and 7.x before 7.0.11 allows remote attackers to cause a denial of service or possibly have unspecified other impact via a wddxPacket XML document that lacks an end-tag for a recordset field element, leading to mishandling in a wddx_deserialize call."
CVE-2016-7414,"The ZIP signature-verification feature in PHP before 5.6.26 and 7.x before 7.0.11 does not ensure that the uncompressed_filesize field is large enough, which allows remote attackers to cause a denial of service (out-of-bounds memory access) or possibly have unspecified other impact via a crafted PHAR archive, related to ext/phar/util.c and ext/phar/zip.c."
CVE-2016-7416,"ext/intl/msgformat/msgformat_format.c in PHP before 5.6.26 and 7.x before 7.0.11 does not properly restrict the locale length provided to the Locale class in the ICU library, which allows remote attackers to cause a denial of service (application crash) or possibly have unspecified other impact via a MessageFormatter::formatMessage call with a long first argument."
CVE-2016-7417,"ext/spl/spl_array.c in PHP before 5.6.26 and 7.x before 7.0.11 proceeds with SplArray unserialization without validating a return value and data type, which allows remote attackers to cause a denial of service or possibly have unspecified other impact via crafted serialized data."
CVE-2016-7418,"The php_wddx_push_element function in ext/wddx/wddx.c in PHP before 5.6.26 and 7.x before 7.0.11 allows remote attackers to cause a denial of service (invalid pointer access and out-of-bounds read) or possibly have unspecified other impact via an incorrect boolean element in a wddxPacket XML document, leading to mishandling in a wddx_deserialize call."
CVE-2016-7480,"The SplObjectStorage unserialize implementation in ext/spl/spl_observer.c in PHP before 7.0.12 does not verify that a key is an object, which allows remote attackers to execute arbitrary code or cause a denial of service (uninitialized memory access) via crafted serialized data."
CVE-2016-9137,Use-after-free vulnerability in the CURLFile implementation in ext/curl/curl_file.c in PHP before 5.6.27 and 7.x before 7.0.12 allows remote attackers to cause a denial of service or possibly have unspecified other impact via crafted serialized data that is mishandled during __wakeup processing.
CVE-2016-9934,"ext/wddx/wddx.c in PHP before 5.6.28 and 7.x before 7.0.13 allows remote attackers to cause a denial of service (NULL pointer dereference) via crafted serialized data in a wddxPacket XML document, as demonstrated by a PDORow string."
CVE-2016-9935,The php_wddx_push_element function in ext/wddx/wddx.c in PHP before 5.6.29 and 7.x before 7.0.14 allows remote attackers to cause a denial of service (out-of-bounds read and memory corruption) or possibly have unspecified other impact via an empty boolean element in a wddxPacket XML document.
CVE-2016-9936,The unserialize implementation in ext/standard/var.c in PHP 7.x before 7.0.14 allows remote attackers to cause a denial of service (use-after-free) or possibly have unspecified other impact via crafted serialized data.  NOTE: this vulnerability exists because of an incomplete fix for CVE-2015-6834.
CVE-2017-11142,"In PHP before 5.6.31, 7.x before 7.0.17, and 7.1.x before 7.1.3, remote attackers could cause a CPU consumption denial of service attack by injecting long form variables, related to main/php_variables.c."
CVE-2017-11143,"In PHP before 5.6.31, an invalid free in the WDDX deserialization of boolean parameters could be used by attackers able to inject XML for deserialization to crash the PHP interpreter, related to an invalid free for an empty boolean element in ext/wddx/wddx.c."
CVE-2017-11144,"In PHP before 5.6.31, 7.x before 7.0.21, and 7.1.x before 7.1.7, the openssl extension PEM sealing code did not check the return value of the OpenSSL sealing function, which could lead to a crash of the PHP interpreter, related to an interpretation conflict for a negative number in ext/openssl/openssl.c, and an OpenSSL documentation omission."
CVE-2017-11145,"In PHP before 5.6.31, 7.x before 7.0.21, and 7.1.x before 7.1.7, an error in the date extension's timelib_meridian parsing code could be used by attackers able to supply date strings to leak information from the interpreter, related to ext/date/lib/parse_date.c out-of-bounds reads affecting the php_parse_date function. NOTE: the correct fix is in the e8b7698f5ee757ce2c8bd10a192a491a498f891c commit, not the bd77ac90d3bdf31ce2a5251ad92e9e75 gist."
CVE-2017-11147,"In PHP before 5.6.30 and 7.x before 7.0.15, the PHAR archive handler could be used by attackers supplying malicious archive files to crash the PHP interpreter or potentially disclose information due to a buffer over-read in the phar_parse_pharfile function in ext/phar/phar.c."
CVE-2017-11628,"In PHP before 5.6.31, 7.x before 7.0.21, and 7.1.x before 7.1.7, a stack-based buffer overflow in the zend_ini_do_op() function in Zend/zend_ini_parser.c could cause a denial of service or potentially allow executing code. NOTE: this is only relevant for PHP applications that accept untrusted input (instead of the system's php.ini file) for the parse_ini_string or parse_ini_file function, e.g., a web application for syntax validation of php.ini directives."
CVE-2017-12932,"ext/standard/var_unserializer.re in PHP 7.0.x through 7.0.22 and 7.1.x through 7.1.8 is prone to a heap use after free while unserializing untrusted data, related to improper use of the hash API for key deletion in a situation with an invalid array size. Exploitation of this issue can have an unspecified impact on the integrity of PHP."
CVE-2017-5340,"Zend/zend_hash.c in PHP before 7.0.15 and 7.1.x before 7.1.1 mishandles certain cases that require large array allocations, which allows remote attackers to execute arbitrary code or cause a denial of service (integer overflow, uninitialized memory access, and use of arbitrary destructor function pointers) via crafted serialized data."
CVE-2017-7189,"main/streams/xp_socket.c in PHP 7.x before 2017-03-07 misparses fsockopen calls, such as by interpreting fsockopen('127.0.0.1:80', 443) as if the address/port were 127.0.0.1:80:443, which is later truncated to 127.0.0.1:80. This behavior has a security risk if the explicitly provided port number (i.e., 443 in this example) is hardcoded into an application as a security policy, but the hostname argument (i.e., 127.0.0.1:80 in this example) is obtained from untrusted input."
CVE-2017-7272,"PHP through 7.1.11 enables potential SSRF in applications that accept an fsockopen or pfsockopen hostname argument with an expectation that the port number is constrained. Because a :port syntax is recognized, fsockopen will use the port number that is specified in the hostname argument, instead of the port number in the second argument of the function."
CVE-2018-15132,"An issue was discovered in ext/standard/link_win32.c in PHP before 5.6.37, 7.0.x before 7.0.31, 7.1.x before 7.1.20, and 7.2.x before 7.2.8. The linkinfo function on Windows doesn't implement the open_basedir check. This could be abused to find files on paths outside of the allowed directories."
CVE-2018-17082,"The Apache2 component in PHP before 5.6.38, 7.0.x before 7.0.32, 7.1.x before 7.1.22, and 7.2.x before 7.2.10 allows XSS via the body of a ""Transfer-Encoding: chunked"" request, because the bucket brigade is mishandled in the php_handler function in sapi/apache2handler/sapi_apache2.c."
CVE-2018-19518,"University of Washington IMAP Toolkit 2007f on UNIX, as used in imap_open() in PHP and other products, launches an rsh command (by means of the imap_rimap function in c-client/imap4r1.c and the tcp_aopen function in osdep/unix/tcp_unix.c) without preventing argument injection, which might allow remote attackers to execute arbitrary OS commands if the IMAP server name is untrusted input (e.g., entered by a user of a web application) and if rsh has been replaced by a program with different argument semantics. For example, if rsh is a link to ssh (as seen on Debian and Ubuntu systems), then the attack can use an IMAP server name containing a ""-oProxyCommand"" argument."
CVE-2018-7584,"In PHP through 5.6.33, 7.0.x before 7.0.28, 7.1.x through 7.1.14, and 7.2.x through 7.2.2, there is a stack-based buffer under-read while parsing an HTTP response in the php_stream_url_wrap_http_ex function in ext/standard/http_fopen_wrapper.c. This subsequently results in copying a large string."
CVE-2010-2958,"Cross-site scripting (XSS) vulnerability in libraries/Error.class.php in phpMyAdmin 3.x before 3.3.6 allows remote attackers to inject arbitrary web script or HTML via vectors related to a PHP backtrace and error messages (aka debugging messages), a different vulnerability than CVE-2010-3056."
CVE-2010-3055,"The configuration setup script (aka scripts/setup.php) in phpMyAdmin 2.11.x before 2.11.10.1 does not properly restrict key names in its output file, which allows remote attackers to execute arbitrary PHP code via a crafted POST request."
CVE-2010-4329,Cross-site scripting (XSS) vulnerability in the PMA_linkOrButton function in libraries/common.lib.php in the database (db) search script in phpMyAdmin 2.11.x before 2.11.11.1 and 3.x before 3.3.8.1 allows remote attackers to inject arbitrary web script or HTML via a crafted request.
CVE-2010-4481,"phpMyAdmin before 3.4.0-beta1 allows remote attackers to bypass authentication and obtain sensitive information via a direct request to phpinfo.php, which calls the phpinfo function."
CVE-2011-0986,"phpMyAdmin 2.11.x before 2.11.11.2, and 3.3.x before 3.3.9.1, does not properly handle the absence of the (1) README, (2) ChangeLog, and (3) LICENSE files, which allows remote attackers to obtain the installation path via a direct request for a nonexistent file."
CVE-2011-0987,"The PMA_Bookmark_get function in libraries/bookmark.lib.php in phpMyAdmin 2.11.x before 2.11.11.3, and 3.3.x before 3.3.9.2, does not properly restrict bookmark queries, which makes it easier for remote authenticated users to trigger another user's execution of a SQL query by creating a bookmark."
CVE-2011-1940,"Multiple cross-site scripting (XSS) vulnerabilities in phpMyAdmin 3.3.x before 3.3.10.1 and 3.4.x before 3.4.1 allow remote attackers to inject arbitrary web script or HTML via a crafted table name that triggers improper HTML rendering on a Tracking page, related to (1) libraries/tbl_links.inc.php and (2) tbl_tracking.php."
CVE-2011-1941,Open redirect vulnerability in the redirector feature in phpMyAdmin 3.4.x before 3.4.1 allows remote attackers to redirect users to arbitrary web sites and conduct phishing attacks via unspecified vectors.
CVE-2011-2505,"libraries/auth/swekey/swekey.auth.lib.php in the Swekey authentication feature in phpMyAdmin 3.x before 3.3.10.2 and 3.4.x before 3.4.3.1 assigns values to arbitrary parameters referenced in the query string, which allows remote attackers to modify the SESSION superglobal array via a crafted request, related to a ""remote variable manipulation vulnerability."""
CVE-2011-2506,"setup/lib/ConfigGenerator.class.php in phpMyAdmin 3.x before 3.3.10.2 and 3.4.x before 3.4.3.1 does not properly restrict the presence of comment closing delimiters, which allows remote attackers to conduct static code injection attacks by leveraging the ability to modify the SESSION superglobal array."
CVE-2011-2507,"libraries/server_synchronize.lib.php in the Synchronize implementation in phpMyAdmin 3.x before 3.3.10.2 and 3.4.x before 3.4.3.1 does not properly quote regular expressions, which allows remote authenticated users to inject a PCRE e (aka PREG_REPLACE_EVAL) modifier, and consequently execute arbitrary PHP code, by leveraging the ability to modify the SESSION superglobal array."
CVE-2011-2508,"Directory traversal vulnerability in libraries/display_tbl.lib.php in phpMyAdmin 3.x before 3.3.10.2 and 3.4.x before 3.4.3.1, when a certain MIME transformation feature is enabled, allows remote authenticated users to include and execute arbitrary local files via a .. (dot dot) in a GLOBALS[mime_map][$meta->name][transformation] parameter."
CVE-2011-2642,Multiple cross-site scripting (XSS) vulnerabilities in the table Print view implementation in tbl_printview.php in phpMyAdmin before 3.3.10.3 and 3.4.x before 3.4.3.2 allow remote authenticated users to inject arbitrary web script or HTML via a crafted table name.
CVE-2011-2643,"Directory traversal vulnerability in sql.php in phpMyAdmin 3.4.x before 3.4.3.2, when configuration storage is enabled, allows remote attackers to include and execute arbitrary local files via directory traversal sequences in a MIME-type transformation parameter."
CVE-2011-2718,"Multiple directory traversal vulnerabilities in the relational schema implementation in phpMyAdmin 3.4.x before 3.4.3.2 allow remote authenticated users to include and execute arbitrary local files via directory traversal sequences in an export type field, related to (1) libraries/schema/User_Schema.class.php and (2) schema_export.php."
CVE-2011-2719,"libraries/auth/swekey/swekey.auth.lib.php in phpMyAdmin 3.x before 3.3.10.3 and 3.4.x before 3.4.3.2 does not properly manage sessions associated with Swekey authentication, which allows remote attackers to modify the SESSION superglobal array, other superglobal arrays, and certain swekey.auth.lib.php local variables via a crafted query string, a related issue to CVE-2011-2505."
CVE-2011-3591,"Multiple cross-site scripting (XSS) vulnerabilities in phpMyAdmin 3.4.x before 3.4.5 allow remote authenticated users to inject arbitrary web script or HTML via a crafted row that triggers an improperly constructed confirmation message after inline-editing and save operations, related to (1) js/functions.js and (2) js/tbl_structure.js."
CVE-2011-3592,"Multiple cross-site scripting (XSS) vulnerabilities in the PMA_unInlineEditRow function in js/sql.js in phpMyAdmin 3.4.x before 3.4.5 allow remote authenticated users to inject arbitrary web script or HTML via a (1) database name, (2) table name, or (3) column name that is not properly handled after an inline-editing operation."
CVE-2011-4634,"Multiple cross-site scripting (XSS) vulnerabilities in phpMyAdmin 3.4.x before 3.4.8 allow remote attackers to inject arbitrary web script or HTML via (1) a crafted database name, related to the Database Synchronize panel; (2) a crafted database name, related to the Database rename panel; (3) a crafted SQL query, related to the table overview panel; (4) a crafted SQL query, related to the view creation dialog; (5) a crafted column type, related to the table search dialog; or (6) a crafted column type, related to the create index dialog."
CVE-2011-4780,"Multiple cross-site scripting (XSS) vulnerabilities in libraries/display_export.lib.php in phpMyAdmin 3.4.x before 3.4.9 allow remote attackers to inject arbitrary web script or HTML via crafted URL parameters, related to the export panels in the (1) server, (2) database, and (3) table sections."
CVE-2011-4782,Cross-site scripting (XSS) vulnerability in libraries/config/ConfigFile.class.php in the setup interface in phpMyAdmin 3.4.x before 3.4.9 allows remote attackers to inject arbitrary web script or HTML via the host parameter.
CVE-2012-1190,Cross-site scripting (XSS) vulnerability in the replication-setup functionality in js/replication.js in phpMyAdmin 3.4.x before 3.4.10.1 allows user-assisted remote attackers to inject arbitrary web script or HTML via a crafted database name.
CVE-2012-1902,"show_config_errors.php in phpMyAdmin 3.4.x before 3.4.10.2, when a configuration file does not exist, allows remote attackers to obtain sensitive information via a direct request, which reveals the installation path in an error message about this missing file."
CVE-2012-4219,"show_config_errors.php in phpMyAdmin 3.5.x before 3.5.2.1 allows remote attackers to obtain sensitive information via a direct request, which reveals the installation path in an error message, related to lack of inclusion of the common.inc.php library file."
CVE-2013-3239,"phpMyAdmin 3.5.x before 3.5.8 and 4.x before 4.0.0-rc3, when a SaveDir directory is configured, allows remote authenticated users to execute arbitrary code by using a double extension in the filename of an export file, leading to interpretation of this file as an executable file by the Apache HTTP Server, as demonstrated by a .php.sql filename."
CVE-2013-3742,Cross-site scripting (XSS) vulnerability in view_create.php (aka the Create View page) in phpMyAdmin 4.x before 4.0.3 allows remote authenticated users to inject arbitrary web script or HTML via an invalid SQL CREATE VIEW statement with a crafted name that triggers an error message.
CVE-2013-4729,"import.php in phpMyAdmin 4.x before 4.0.4.1 does not properly restrict the ability of input data to specify a file format, which allows remote authenticated users to modify the GLOBALS superglobal array, and consequently change the configuration, via a crafted request."
CVE-2013-5029,phpMyAdmin 3.5.x and 4.0.x before 4.0.5 allows remote attackers to bypass the clickjacking protection mechanism via certain vectors related to Header.class.php.
CVE-2014-1879,Cross-site scripting (XSS) vulnerability in import.php in phpMyAdmin before 4.1.7 allows remote authenticated users to inject arbitrary web script or HTML via a crafted filename in an import action.
CVE-2014-4348,Multiple cross-site scripting (XSS) vulnerabilities in phpMyAdmin 4.2.x before 4.2.4 allow remote authenticated users to inject arbitrary web script or HTML via a crafted (1) database name or (2) table name that is improperly handled after presence in (a) the favorite list or (b) recent tables.
CVE-2014-4349,Multiple cross-site scripting (XSS) vulnerabilities in phpMyAdmin 4.1.x before 4.1.14.1 and 4.2.x before 4.2.4 allow remote authenticated users to inject arbitrary web script or HTML via a crafted table name that is improperly handled after a (1) hide or (2) unhide action.
CVE-2014-4954,Cross-site scripting (XSS) vulnerability in the PMA_getHtmlForActionLinks function in libraries/structure.lib.php in phpMyAdmin 4.2.x before 4.2.6 allows remote authenticated users to inject arbitrary web script or HTML via a crafted table comment that is improperly handled during construction of a database structure page.
