cve,desc
CVE-2017-17935,"The File_read_line function in epan/wslua/wslua_file.c in Wireshark through 2.2.11 does not properly strip '\n' characters, which allows remote attackers to cause a denial of service (buffer underflow and application crash) via a crafted packet that triggers the attempted processing of an empty line."
CVE-2017-17997,"In Wireshark before 2.2.12, the MRDISC dissector misuses a NULL pointer and crashes. This was addressed in epan/dissectors/packet-mrdisc.c by validating an IPv4 address. This vulnerability is similar to CVE-2017-9343."
CVE-2017-5596,"In Wireshark 2.2.0 to 2.2.3 and 2.0.0 to 2.0.9, the ASTERIX dissector could go into an infinite loop, triggered by packet injection or a malformed capture file. This was addressed in epan/dissectors/packet-asterix.c by changing a data type to avoid an integer overflow."
CVE-2017-5597,"In Wireshark 2.2.0 to 2.2.3 and 2.0.0 to 2.0.9, the DHCPv6 dissector could go into a large loop, triggered by packet injection or a malformed capture file. This was addressed in epan/dissectors/packet-dhcpv6.c by changing a data type to avoid an integer overflow."
CVE-2017-6467,"In Wireshark 2.2.0 to 2.2.4 and 2.0.0 to 2.0.10, there is a Netscaler file parser infinite loop, triggered by a malformed capture file. This was addressed in wiretap/netscaler.c by changing the restrictions on file size."
CVE-2017-6470,"In Wireshark 2.2.0 to 2.2.4 and 2.0.0 to 2.0.10, there is an IAX2 infinite loop, triggered by packet injection or a malformed capture file. This was addressed in epan/dissectors/packet-iax2.c by constraining packet lateness."
CVE-2017-6471,"In Wireshark 2.2.0 to 2.2.4 and 2.0.0 to 2.0.10, there is a WSP infinite loop, triggered by packet injection or a malformed capture file. This was addressed in epan/dissectors/packet-wsp.c by validating the capability length."
CVE-2017-6472,"In Wireshark 2.2.0 to 2.2.4 and 2.0.0 to 2.0.10, there is an RTMPT dissector infinite loop, triggered by packet injection or a malformed capture file. This was addressed in epan/dissectors/packet-rtmpt.c by properly incrementing a certain sequence value."
CVE-2017-6473,"In Wireshark 2.2.0 to 2.2.4 and 2.0.0 to 2.0.10, there is a K12 file parser crash, triggered by a malformed capture file. This was addressed in wiretap/k12.c by validating the relationships between lengths and offsets."
CVE-2017-6474,"In Wireshark 2.2.0 to 2.2.4 and 2.0.0 to 2.0.10, there is a NetScaler file parser infinite loop, triggered by a malformed capture file. This was addressed in wiretap/netscaler.c by validating record sizes."
CVE-2017-7700,"In Wireshark 2.2.0 to 2.2.5 and 2.0.0 to 2.0.11, the NetScaler file parser could go into an infinite loop, triggered by a malformed capture file. This was addressed in wiretap/netscaler.c by ensuring a nonzero record size."
CVE-2017-7701,"In Wireshark 2.2.0 to 2.2.5 and 2.0.0 to 2.0.11, the BGP dissector could go into an infinite loop, triggered by packet injection or a malformed capture file. This was addressed in epan/dissectors/packet-bgp.c by using a different integer data type."
CVE-2017-7702,"In Wireshark 2.2.0 to 2.2.5 and 2.0.0 to 2.0.11, the WBXML dissector could go into an infinite loop, triggered by packet injection or a malformed capture file. This was addressed in epan/dissectors/packet-wbxml.c by adding length validation."
CVE-2017-7703,"In Wireshark 2.2.0 to 2.2.5 and 2.0.0 to 2.0.11, the IMAP dissector could crash, triggered by packet injection or a malformed capture file. This was addressed in epan/dissectors/packet-imap.c by calculating a line's end correctly."
CVE-2017-7704,"In Wireshark 2.2.0 to 2.2.5, the DOF dissector could go into an infinite loop, triggered by packet injection or a malformed capture file. This was addressed in epan/dissectors/packet-dof.c by using a different integer data type and adjusting a return value."
CVE-2017-7705,"In Wireshark 2.2.0 to 2.2.5 and 2.0.0 to 2.0.11, the RPC over RDMA dissector could go into an infinite loop, triggered by packet injection or a malformed capture file. This was addressed in epan/dissectors/packet-rpcrdma.c by correctly checking for going beyond the maximum offset."
CVE-2017-7745,"In Wireshark 2.2.0 to 2.2.5 and 2.0.0 to 2.0.11, the SIGCOMP dissector could go into an infinite loop, triggered by packet injection or a malformed capture file. This was addressed in epan/dissectors/packet-sigcomp.c by correcting a memory-size check."
CVE-2017-7746,"In Wireshark 2.2.0 to 2.2.5 and 2.0.0 to 2.0.11, the SLSK dissector could go into an infinite loop, triggered by packet injection or a malformed capture file. This was addressed in epan/dissectors/packet-slsk.c by adding checks for the remaining length."
CVE-2017-7747,"In Wireshark 2.2.0 to 2.2.5 and 2.0.0 to 2.0.11, the PacketBB dissector could crash, triggered by packet injection or a malformed capture file. This was addressed in epan/dissectors/packet-packetbb.c by restricting additions to the protocol tree."
CVE-2017-7748,"In Wireshark 2.2.0 to 2.2.5 and 2.0.0 to 2.0.11, the WSP dissector could go into an infinite loop, triggered by packet injection or a malformed capture file. This was addressed in epan/dissectors/packet-wsp.c by adding a length check."
CVE-2017-9343,"In Wireshark 2.2.0 to 2.2.6 and 2.0.0 to 2.0.12, the MSNIP dissector misuses a NULL pointer. This was addressed in epan/dissectors/packet-msnip.c by validating an IPv4 address."
CVE-2017-9344,"In Wireshark 2.2.0 to 2.2.6 and 2.0.0 to 2.0.12, the Bluetooth L2CAP dissector could divide by zero. This was addressed in epan/dissectors/packet-btl2cap.c by validating an interval value."
CVE-2017-9345,"In Wireshark 2.2.0 to 2.2.6 and 2.0.0 to 2.0.12, the DNS dissector could go into an infinite loop. This was addressed in epan/dissectors/packet-dns.c by trying to detect self-referencing pointers."
CVE-2017-9346,"In Wireshark 2.2.0 to 2.2.6 and 2.0.0 to 2.0.12, the SoulSeek dissector could go into an infinite loop. This was addressed in epan/dissectors/packet-slsk.c by making loop bounds more explicit."
CVE-2017-9347,"In Wireshark 2.2.0 to 2.2.6, the ROS dissector could crash with a NULL pointer dereference. This was addressed in epan/dissectors/asn1/ros/packet-ros-template.c by validating an OID."
CVE-2017-9348,"In Wireshark 2.2.0 to 2.2.6, the DOF dissector could read past the end of a buffer. This was addressed in epan/dissectors/packet-dof.c by validating a size value."
CVE-2017-9349,"In Wireshark 2.2.0 to 2.2.6 and 2.0.0 to 2.0.12, the DICOM dissector has an infinite loop. This was addressed in epan/dissectors/packet-dcm.c by validating a length value."
CVE-2017-9350,"In Wireshark 2.2.0 to 2.2.6 and 2.0.0 to 2.0.12, the openSAFETY dissector could crash or exhaust system memory. This was addressed in epan/dissectors/packet-opensafety.c by checking for a negative length."
CVE-2017-9351,"In Wireshark 2.2.0 to 2.2.6 and 2.0.0 to 2.0.12, the DHCP dissector could read past the end of a buffer. This was addressed in epan/dissectors/packet-bootp.c by extracting the Vendor Class Identifier more carefully."
CVE-2017-9352,"In Wireshark 2.2.0 to 2.2.6 and 2.0.0 to 2.0.12, the Bazaar dissector could go into an infinite loop. This was addressed in epan/dissectors/packet-bzr.c by ensuring that backwards parsing cannot occur."
CVE-2017-9353,"In Wireshark 2.2.0 to 2.2.6, the IPv6 dissector could crash. This was addressed in epan/dissectors/packet-ipv6.c by validating an IPv6 address."
CVE-2017-9354,"In Wireshark 2.2.0 to 2.2.6 and 2.0.0 to 2.0.12, the RGMP dissector could crash. This was addressed in epan/dissectors/packet-rgmp.c by validating an IPv4 address."
CVE-2017-9766,"In Wireshark 2.2.7, PROFINET IO data with a high recursion depth allows remote attackers to cause a denial of service (stack exhaustion) in the dissect_IODWriteReq function in plugins/profinet/packet-dcerpc-pn-io.c."
CVE-2018-11354,"In Wireshark 2.6.0, the IEEE 1905.1a dissector could crash. This was addressed in epan/dissectors/packet-ieee1905.c by making a certain correction to string handling."
CVE-2018-11355,"In Wireshark 2.6.0, the RTCP dissector could crash. This was addressed in epan/dissectors/packet-rtcp.c by avoiding a buffer overflow for packet status chunks."
CVE-2018-11356,"In Wireshark 2.6.0, 2.4.0 to 2.4.6, and 2.2.0 to 2.2.14, the DNS dissector could crash. This was addressed in epan/dissectors/packet-dns.c by avoiding a NULL pointer dereference for an empty name in an SRV record."
CVE-2018-11357,"In Wireshark 2.6.0, 2.4.0 to 2.4.6, and 2.2.0 to 2.2.14, the LTP dissector and other dissectors could consume excessive memory. This was addressed in epan/tvbuff.c by rejecting negative lengths."
CVE-2018-11358,"In Wireshark 2.6.0, 2.4.0 to 2.4.6, and 2.2.0 to 2.2.14, the Q.931 dissector could crash. This was addressed in epan/dissectors/packet-q931.c by avoiding a use-after-free after a malformed packet prevented certain cleanup."
CVE-2018-11359,"In Wireshark 2.6.0, 2.4.0 to 2.4.6, and 2.2.0 to 2.2.14, the RRC dissector and other dissectors could crash. This was addressed in epan/proto.c by avoiding a NULL pointer dereference."
CVE-2018-11360,"In Wireshark 2.6.0, 2.4.0 to 2.4.6, and 2.2.0 to 2.2.14, the GSM A DTAP dissector could crash. This was addressed in epan/dissectors/packet-gsm_a_dtap.c by fixing an off-by-one error that caused a buffer overflow."
CVE-2018-11361,"In Wireshark 2.6.0, the IEEE 802.11 protocol dissector could crash. This was addressed in epan/crypt/dot11decrypt.c by avoiding a buffer overflow during FTE processing in Dot11DecryptTDLSDeriveKey."
CVE-2018-11362,"In Wireshark 2.6.0, 2.4.0 to 2.4.6, and 2.2.0 to 2.2.14, the LDSS dissector could crash. This was addressed in epan/dissectors/packet-ldss.c by avoiding a buffer over-read upon encountering a missing '\0' character."
CVE-2018-14339,"In Wireshark 2.6.0 to 2.6.1, 2.4.0 to 2.4.7, and 2.2.0 to 2.2.15, the MMSE dissector could go into an infinite loop. This was addressed in epan/proto.c by adding offset and length validation."
CVE-2018-14340,"In Wireshark 2.6.0 to 2.6.1, 2.4.0 to 2.4.7, and 2.2.0 to 2.2.15, dissectors that support zlib decompression could crash. This was addressed in epan/tvbuff_zlib.c by rejecting negative lengths to avoid a buffer over-read."
CVE-2018-14341,"In Wireshark 2.6.0 to 2.6.1, 2.4.0 to 2.4.7, and 2.2.0 to 2.2.15, the DICOM dissector could go into a large or infinite loop. This was addressed in epan/dissectors/packet-dcm.c by preventing an offset overflow."
CVE-2018-14342,"In Wireshark 2.6.0 to 2.6.1, 2.4.0 to 2.4.7, and 2.2.0 to 2.2.15, the BGP protocol dissector could go into a large loop. This was addressed in epan/dissectors/packet-bgp.c by validating Path Attribute lengths."
CVE-2018-14343,"In Wireshark 2.6.0 to 2.6.1, 2.4.0 to 2.4.7, and 2.2.0 to 2.2.15, the ASN.1 BER dissector could crash. This was addressed in epan/dissectors/packet-ber.c by ensuring that length values do not exceed the maximum signed integer."
CVE-2018-14344,"In Wireshark 2.6.0 to 2.6.1, 2.4.0 to 2.4.7, and 2.2.0 to 2.2.15, the ISMP dissector could crash. This was addressed in epan/dissectors/packet-ismp.c by validating the IPX address length to avoid a buffer over-read."
CVE-2018-14367,"In Wireshark 2.6.0 to 2.6.1 and 2.4.0 to 2.4.7, the CoAP protocol dissector could crash. This was addressed in epan/dissectors/packet-coap.c by properly checking for a NULL condition."
CVE-2018-14368,"In Wireshark 2.6.0 to 2.6.1, 2.4.0 to 2.4.7, and 2.2.0 to 2.2.15, the Bazaar protocol dissector could go into an infinite loop. This was addressed in epan/dissectors/packet-bzr.c by properly handling items that are too long."
CVE-2018-14369,"In Wireshark 2.6.0 to 2.6.1, 2.4.0 to 2.4.7, and 2.2.0 to 2.2.15, the HTTP2 dissector could crash. This was addressed in epan/dissectors/packet-http2.c by verifying that header data was found before proceeding to header decompression."
CVE-2018-14370,"In Wireshark 2.6.0 to 2.6.1 and 2.4.0 to 2.4.7, the IEEE 802.11 protocol dissector could crash. This was addressed in epan/crypt/airpdcap.c via bounds checking that prevents a buffer over-read."
CVE-2018-16056,"In Wireshark 2.6.0 to 2.6.2, 2.4.0 to 2.4.8, and 2.2.0 to 2.2.16, the Bluetooth Attribute Protocol dissector could crash. This was addressed in epan/dissectors/packet-btatt.c by verifying that a dissector for a specific UUID exists."
CVE-2018-16057,"In Wireshark 2.6.0 to 2.6.2, 2.4.0 to 2.4.8, and 2.2.0 to 2.2.16, the Radiotap dissector could crash. This was addressed in epan/dissectors/packet-ieee80211-radiotap-iter.c by validating iterator operations."
CVE-2018-16058,"In Wireshark 2.6.0 to 2.6.2, 2.4.0 to 2.4.8, and 2.2.0 to 2.2.16, the Bluetooth AVDTP dissector could crash. This was addressed in epan/dissectors/packet-btavdtp.c by properly initializing a data structure."
CVE-2018-18225,"In Wireshark 2.6.0 to 2.6.3, the CoAP dissector could crash. This was addressed in epan/dissectors/packet-coap.c by ensuring that the piv length is correctly computed."
CVE-2018-18226,"In Wireshark 2.6.0 to 2.6.3, the Steam IHS Discovery dissector could consume system memory. This was addressed in epan/dissectors/packet-steam-ihs-discovery.c by changing the memory-management approach."
CVE-2018-18227,"In Wireshark 2.6.0 to 2.6.3 and 2.4.0 to 2.4.9, the MS-WSP protocol dissector could crash. This was addressed in epan/dissectors/packet-mswsp.c by properly handling NULL return values."
CVE-2018-19622,"In Wireshark 2.6.0 to 2.6.4 and 2.4.0 to 2.4.10, the MMSE dissector could go into an infinite loop. This was addressed in epan/dissectors/packet-mmse.c by preventing length overflows."
CVE-2018-19623,"In Wireshark 2.6.0 to 2.6.4 and 2.4.0 to 2.4.10, the LBMPDM dissector could crash. In addition, a remote attacker could write arbitrary data to any memory locations before the packet-scoped memory. This was addressed in epan/dissectors/packet-lbmpdm.c by disallowing certain negative values."
CVE-2018-19624,"In Wireshark 2.6.0 to 2.6.4 and 2.4.0 to 2.4.10, the PVFS dissector could crash. This was addressed in epan/dissectors/packet-pvfs2.c by preventing a NULL pointer dereference."
CVE-2018-19625,"In Wireshark 2.6.0 to 2.6.4 and 2.4.0 to 2.4.10, the dissection engine could crash. This was addressed in epan/tvbuff_composite.c by preventing a heap-based buffer over-read."
CVE-2018-19626,"In Wireshark 2.6.0 to 2.6.4 and 2.4.0 to 2.4.10, the DCOM dissector could crash. This was addressed in epan/dissectors/packet-dcom.c by adding '\0' termination."
CVE-2018-19627,"In Wireshark 2.6.0 to 2.6.4 and 2.4.0 to 2.4.10, the IxVeriWave file parser could crash. This was addressed in wiretap/vwr.c by adjusting a buffer boundary."
CVE-2018-19628,"In Wireshark 2.6.0 to 2.6.4, the ZigBee ZCL dissector could crash. This was addressed in epan/dissectors/packet-zbee-zcl-lighting.c by preventing a divide-by-zero error."
CVE-2018-5334,"In Wireshark 2.4.0 to 2.4.3 and 2.2.0 to 2.2.11, the IxVeriWave file parser could crash. This was addressed in wiretap/vwr.c by correcting the signature timestamp bounds checks."
CVE-2018-5335,"In Wireshark 2.4.0 to 2.4.3 and 2.2.0 to 2.2.11, the WCP dissector could crash. This was addressed in epan/dissectors/packet-wcp.c by validating the available buffer length."
CVE-2018-5336,"In Wireshark 2.4.0 to 2.4.3 and 2.2.0 to 2.2.11, the JSON, XML, NTP, XMPP, and GDB dissectors could crash. This was addressed in epan/tvbparse.c by limiting the recursion depth."
CVE-2018-6836,"The netmonrec_comment_destroy function in wiretap/netmon.c in Wireshark through 2.4.4 performs a free operation on an uninitialized memory address, which allows remote attackers to cause a denial of service (application crash) or possibly have unspecified other impact."
CVE-2018-7320,"In Wireshark 2.4.0 to 2.4.4 and 2.2.0 to 2.2.12, the SIGCOMP protocol dissector could crash. This was addressed in epan/dissectors/packet-sigcomp.c by validating operand offsets."
CVE-2018-7321,"In Wireshark 2.4.0 to 2.4.4 and 2.2.0 to 2.2.12, epan/dissectors/packet-thrift.c had a large loop that was addressed by not proceeding with dissection after encountering an unexpected type."
CVE-2018-7322,"In Wireshark 2.4.0 to 2.4.4 and 2.2.0 to 2.2.12, epan/dissectors/packet-dcm.c had an infinite loop that was addressed by checking for integer wraparound."
CVE-2018-7323,"In Wireshark 2.4.0 to 2.4.4 and 2.2.0 to 2.2.12, epan/dissectors/packet-wccp.c had a large loop that was addressed by ensuring that a calculated length was monotonically increasing."
CVE-2018-7324,"In Wireshark 2.4.0 to 2.4.4 and 2.2.0 to 2.2.12, epan/dissectors/packet-sccp.c had an infinite loop that was addressed by using a correct integer data type."
CVE-2018-7325,"In Wireshark 2.4.0 to 2.4.4 and 2.2.0 to 2.2.12, epan/dissectors/packet-rpki-rtr.c had an infinite loop that was addressed by validating a length field."
CVE-2018-7326,"In Wireshark 2.4.0 to 2.4.4 and 2.2.0 to 2.2.12, epan/dissectors/packet-lltd.c had an infinite loop that was addressed by using a correct integer data type."
CVE-2018-7327,"In Wireshark 2.4.0 to 2.4.4 and 2.2.0 to 2.2.12, epan/dissectors/packet-openflow_v6.c had an infinite loop that was addressed by validating property lengths."
CVE-2018-7328,"In Wireshark 2.4.0 to 2.4.4 and 2.2.0 to 2.2.12, epan/dissectors/packet-usb.c had an infinite loop that was addressed by rejecting short frame header lengths."
CVE-2018-7329,"In Wireshark 2.4.0 to 2.4.4 and 2.2.0 to 2.2.12, epan/dissectors/packet-s7comm.c had an infinite loop that was addressed by correcting off-by-one errors."
CVE-2018-7330,"In Wireshark 2.4.0 to 2.4.4 and 2.2.0 to 2.2.12, epan/dissectors/packet-thread.c had an infinite loop that was addressed by using a correct integer data type."
CVE-2018-7331,"In Wireshark 2.4.0 to 2.4.4 and 2.2.0 to 2.2.12, epan/dissectors/packet-ber.c had an infinite loop that was addressed by validating a length."
CVE-2018-7332,"In Wireshark 2.4.0 to 2.4.4 and 2.2.0 to 2.2.12, epan/dissectors/packet-reload.c had an infinite loop that was addressed by validating a length."
CVE-2018-7333,"In Wireshark 2.4.0 to 2.4.4 and 2.2.0 to 2.2.12, epan/dissectors/packet-rpcrdma.c had an infinite loop that was addressed by validating a chunk size."
CVE-2018-7334,"In Wireshark 2.4.0 to 2.4.4 and 2.2.0 to 2.2.12, the UMTS MAC dissector could crash. This was addressed in epan/dissectors/packet-umts_mac.c by rejecting a certain reserved value."
CVE-2018-7335,"In Wireshark 2.4.0 to 2.4.4 and 2.2.0 to 2.2.12, the IEEE 802.11 dissector could crash. This was addressed in epan/crypt/airpdcap.c by rejecting lengths that are too small."
CVE-2018-7336,"In Wireshark 2.4.0 to 2.4.4 and 2.2.0 to 2.2.12, the FCP protocol dissector could crash. This was addressed in epan/dissectors/packet-fcp.c by checking for a NULL pointer."
CVE-2018-7337,"In Wireshark 2.4.0 to 2.4.4, the DOCSIS protocol dissector could crash. This was addressed in plugins/docsis/packet-docsis.c by removing the recursive algorithm that had been used for concatenated PDUs."
CVE-2018-7417,"In Wireshark 2.2.0 to 2.2.12 and 2.4.0 to 2.4.4, the IPMI dissector could crash. This was addressed in epan/dissectors/packet-ipmi-picmg.c by adding support for crafted packets that lack an IPMI header."
CVE-2018-7418,"In Wireshark 2.2.0 to 2.2.12 and 2.4.0 to 2.4.4, the SIGCOMP dissector could crash. This was addressed in epan/dissectors/packet-sigcomp.c by correcting the extraction of the length value."
CVE-2018-7419,"In Wireshark 2.2.0 to 2.2.12 and 2.4.0 to 2.4.4, the NBAP dissector could crash. This was addressed in epan/dissectors/asn1/nbap/nbap.cnf by ensuring DCH ID initialization."
CVE-2018-7420,"In Wireshark 2.2.0 to 2.2.12 and 2.4.0 to 2.4.4, the pcapng file parser could crash. This was addressed in wiretap/pcapng.c by adding a block-size check for sysdig event blocks."
CVE-2018-7421,"In Wireshark 2.2.0 to 2.2.12 and 2.4.0 to 2.4.4, the DMP dissector could go into an infinite loop. This was addressed in epan/dissectors/packet-dmp.c by correctly supporting a bounded number of Security Categories for a DMP Security Classification."
CVE-2018-9256,"In Wireshark 2.4.0 to 2.4.5 and 2.2.0 to 2.2.13, the LWAPP dissector could crash. This was addressed in epan/dissectors/packet-lwapp.c by limiting the encapsulation levels to restrict the recursion depth."
CVE-2018-9257,"In Wireshark 2.4.0 to 2.4.5, the CQL dissector could go into an infinite loop. This was addressed in epan/dissectors/packet-cql.c by checking for a nonzero number of columns."
CVE-2018-9258,"In Wireshark 2.4.0 to 2.4.5, the TCP dissector could crash. This was addressed in epan/dissectors/packet-tcp.c by preserving valid data sources."
CVE-2018-9259,"In Wireshark 2.4.0 to 2.4.5 and 2.2.0 to 2.2.13, the MP4 dissector could crash. This was addressed in epan/dissectors/file-mp4.c by restricting the box recursion depth."
CVE-2018-9260,"In Wireshark 2.4.0 to 2.4.5 and 2.2.0 to 2.2.13, the IEEE 802.15.4 dissector could crash. This was addressed in epan/dissectors/packet-ieee802154.c by ensuring that an allocation step occurs."
CVE-2018-9261,"In Wireshark 2.4.0 to 2.4.5 and 2.2.0 to 2.2.13, the NBAP dissector could crash with a large loop that ends with a heap-based buffer overflow. This was addressed in epan/dissectors/packet-nbap.c by prohibiting the self-linking of DCH-IDs."
CVE-2018-9262,"In Wireshark 2.4.0 to 2.4.5 and 2.2.0 to 2.2.13, the VLAN dissector could crash. This was addressed in epan/dissectors/packet-vlan.c by limiting VLAN tag nesting to restrict the recursion depth."
CVE-2018-9263,"In Wireshark 2.4.0 to 2.4.5 and 2.2.0 to 2.2.13, the Kerberos dissector could crash. This was addressed in epan/dissectors/packet-kerberos.c by ensuring a nonzero key length."
CVE-2018-9264,"In Wireshark 2.4.0 to 2.4.5 and 2.2.0 to 2.2.13, the ADB dissector could crash with a heap-based buffer overflow. This was addressed in epan/dissectors/packet-adb.c by checking for a length inconsistency."
CVE-2018-9265,"In Wireshark 2.4.0 to 2.4.5 and 2.2.0 to 2.2.13, epan/dissectors/packet-tn3270.c has a memory leak."
CVE-2018-9266,"In Wireshark 2.4.0 to 2.4.5 and 2.2.0 to 2.2.13, epan/dissectors/packet-isup.c has a memory leak."
CVE-2018-9267,"In Wireshark 2.4.0 to 2.4.5 and 2.2.0 to 2.2.13, epan/dissectors/packet-lapd.c has a memory leak."
CVE-2018-9268,"In Wireshark 2.4.0 to 2.4.5 and 2.2.0 to 2.2.13, epan/dissectors/packet-smb2.c has a memory leak."
CVE-2018-9269,"In Wireshark 2.4.0 to 2.4.5 and 2.2.0 to 2.2.13, epan/dissectors/packet-giop.c has a memory leak."
CVE-2018-9270,"In Wireshark 2.4.0 to 2.4.5 and 2.2.0 to 2.2.13, epan/oids.c has a memory leak."
CVE-2018-9271,"In Wireshark 2.4.0 to 2.4.5 and 2.2.0 to 2.2.13, epan/dissectors/packet-multipart.c has a memory leak."
CVE-2018-9272,"In Wireshark 2.4.0 to 2.4.5 and 2.2.0 to 2.2.13, epan/dissectors/packet-h223.c has a memory leak."
CVE-2018-9273,"In Wireshark 2.4.0 to 2.4.5 and 2.2.0 to 2.2.13, epan/dissectors/packet-pcp.c has a memory leak."
CVE-2018-9274,"In Wireshark 2.4.0 to 2.4.5 and 2.2.0 to 2.2.13, ui/failure_message.c has a memory leak."
CVE-2019-10894,"In Wireshark 2.4.0 to 2.4.13, 2.6.0 to 2.6.7, and 3.0.0, the GSS-API dissector could crash. This was addressed in epan/dissectors/packet-gssapi.c by ensuring that a valid dissector is called."
CVE-2019-10895,"In Wireshark 2.4.0 to 2.4.13, 2.6.0 to 2.6.7, and 3.0.0, the NetScaler file parser could crash. This was addressed in wiretap/netscaler.c by improving data validation."
CVE-2019-10896,"In Wireshark 2.4.0 to 2.4.13, 2.6.0 to 2.6.7, and 3.0.0, the DOF dissector could crash. This was addressed in epan/dissectors/packet-dof.c by properly handling generated IID and OID bytes."
CVE-2019-10897,"In Wireshark 3.0.0, the IEEE 802.11 dissector could go into an infinite loop. This was addressed in epan/dissectors/packet-ieee80211.c by detecting cases in which the bit offset does not advance."
CVE-2019-10898,"In Wireshark 3.0.0, the GSUP dissector could go into an infinite loop. This was addressed in epan/dissectors/packet-gsm_gsup.c by rejecting an invalid Information Element length."
CVE-2019-10899,"In Wireshark 2.4.0 to 2.4.13, 2.6.0 to 2.6.7, and 3.0.0, the SRVLOC dissector could crash. This was addressed in epan/dissectors/packet-srvloc.c by preventing a heap-based buffer under-read."
CVE-2019-10900,"In Wireshark 3.0.0, the Rbm dissector could go into an infinite loop. This was addressed in epan/dissectors/file-rbm.c by handling unknown object types safely."
CVE-2019-10901,"In Wireshark 2.4.0 to 2.4.13, 2.6.0 to 2.6.7, and 3.0.0, the LDSS dissector could crash. This was addressed in epan/dissectors/packet-ldss.c by handling file digests properly."
CVE-2019-10902,"In Wireshark 3.0.0, the TSDNS dissector could crash. This was addressed in epan/dissectors/packet-tsdns.c by splitting strings safely."
CVE-2019-10903,"In Wireshark 2.4.0 to 2.4.13, 2.6.0 to 2.6.7, and 3.0.0, the DCERPC SPOOLSS dissector could crash. This was addressed in epan/dissectors/packet-dcerpc-spoolss.c by adding a boundary check."
CVE-2019-12295,"In Wireshark 3.0.0 to 3.0.1, 2.6.0 to 2.6.8, and 2.4.0 to 2.4.14, the dissection engine could crash. This was addressed in epan/packet.c by restricting the number of layers and consequently limiting recursion."
CVE-2019-13619,"In Wireshark 3.0.0 to 3.0.2, 2.6.0 to 2.6.9, and 2.4.0 to 2.4.15, the ASN.1 BER dissector and related dissectors could crash. This was addressed in epan/asn1.c by properly restricting buffer increments."
CVE-2019-16319,"In Wireshark 3.0.0 to 3.0.3 and 2.6.0 to 2.6.10, the Gryphon dissector could go into an infinite loop. This was addressed in plugins/epan/gryphon/packet-gryphon.c by checking for a message length of zero."
CVE-2019-19553,"In Wireshark 3.0.0 to 3.0.6 and 2.6.0 to 2.6.12, the CMS dissector could crash. This was addressed in epan/dissectors/asn1/cms/packet-cms-template.c by ensuring that an object identifier is set to NULL after a ContentInfo dissection."
CVE-2019-5716,"In Wireshark 2.6.0 to 2.6.5, the 6LoWPAN dissector could crash. This was addressed in epan/dissectors/packet-6lowpan.c by avoiding use of a TVB before its creation."
