cve,desc
CVE-2009-0385,"Integer signedness error in the fourxm_read_header function in libavformat/4xm.c in FFmpeg before revision 16846 allows remote attackers to execute arbitrary code via a malformed 4X movie file with a large current_track value, which triggers a NULL pointer dereference."
CVE-2010-3429,"flicvideo.c in libavcodec 0.6 and earlier in FFmpeg, as used in MPlayer and other products, allows remote attackers to execute arbitrary code via a crafted flic file, related to an ""arbitrary offset dereference vulnerability."""
CVE-2010-4704,"libavcodec/vorbis_dec.c in the Vorbis decoder in FFmpeg 0.6.1 and earlier allows remote attackers to cause a denial of service (application crash) via a crafted .ogg file, related to the vorbis_floor0_decode function.  NOTE: this might overlap CVE-2011-0480."
CVE-2011-0480,"Multiple buffer overflows in vorbis_dec.c in the Vorbis decoder in FFmpeg, as used in Google Chrome before 8.0.552.237 and Chrome OS before 8.0.552.344, allow remote attackers to cause a denial of service (memory corruption and application crash) or possibly have unspecified other impact via a crafted WebM file, related to buffers for (1) the channel floor and (2) the channel residue."
CVE-2011-1931,"sp5xdec.c in the Sunplus SP5X JPEG decoder in libavcodec in FFmpeg before 0.6.3 and libav through 0.6.2, as used in VideoLAN VLC media player 1.1.9 and earlier and other products, performs a write operation outside the bounds of an unspecified array, which allows remote attackers to cause a denial of service (memory corruption) or possibly execute arbitrary code via a malformed AMV file."
CVE-2011-2161,"The ape_read_header function in ape.c in libavformat in FFmpeg before 0.5.4, as used in MPlayer, VideoLAN VLC media player, and other products, allows remote attackers to cause a denial of service (application crash) via an APE (aka Monkey's Audio) file that contains a header but no frames."
CVE-2011-3362,"Integer signedness error in the decode_residual_block function in cavsdec.c in libavcodec in FFmpeg before 0.7.3 and 0.8.x before 0.8.2, and libav through 0.7.1, allows remote attackers to cause a denial of service (memory corruption and application crash) or possibly execute arbitrary code via a crafted Chinese AVS video (aka CAVS) file."
CVE-2011-3934,Double free vulnerability in the vp3_update_thread_context function in libavcodec/vp3.c in FFmpeg before 0.10 allows remote attackers to have an unspecified impact via crafted vp3 data.
CVE-2011-3935,The codec_get_buffer function in ffmpeg.c in FFmpeg before 0.10 allows remote attackers to have an unspecified impact via vectors related to a crafted image size.
CVE-2011-3937,"The H.263 codec (libavcodec/h263dec.c) in FFmpeg 0.7.x before 0.7.12, 0.8.x before 0.8.11, and unspecified versions before 0.10, and in Libav 0.5.x before 0.5.9, 0.6.x before 0.6.6, 0.7.x before 0.7.5, and 0.8.x before 0.8.1 has unspecified impact and attack vectors related to ""width/height changing with frame threads."""
CVE-2011-3940,"nsvdec.c in libavcodec in FFmpeg 0.7.x before 0.7.12 and 0.8.x before 0.8.11, and in Libav 0.5.x before 0.5.9, 0.6.x before 0.6.6, 0.7.x before 0.7.5, and 0.8.x before 0.8.1, allows remote attackers to cause a denial of service (out-of-bounds read and write) via a crafted NSV file that triggers ""use of uninitialized streams."""
CVE-2011-3941,"The decode_mb function in libavcodec/error_resilience.c in FFmpeg before 0.10 allows remote attackers to have an unspecified impact via vectors related to an uninitialized block index, which triggers an out-of-bounds write."
CVE-2011-3944,The smacker_decode_header_tree function in libavcodec/smacker.c in FFmpeg before 0.10 allows remote attackers to have an unspecified impact via crafted Smacker data.
CVE-2011-3945,"The decode_frame function in the KVG1 decoder (kgv1dec.c) in libavcodec in FFmpeg 0.7.x before 0.7.12 and 0.8.x before 0.8.11, and in Libav 0.5.x before 0.5.9, 0.6.x before 0.6.6, 0.7.x before 0.7.5, and 0.8.x before 0.8.1, allows remote attackers to cause a denial of service (crash) and possibly execute arbitrary code via a crafted media file."
CVE-2011-3946,"The ff_h264_decode_sei function in libavcodec/h264_sei.c in FFmpeg before 0.10 allows remote attackers to have an unspecified impact via crafted Supplemental enhancement information (SEI) data, which triggers an infinite loop."
CVE-2011-3947,"Buffer overflow in mjpegbdec.c in libavcodec in FFmpeg 0.7.x before 0.7.12 and 0.8.x before 0.8.11, and in Libav 0.5.x before 0.5.9, 0.6.x before 0.6.6, 0.7.x before 0.7.5, and 0.8.x before 0.8.1, allows remote attackers to cause a denial of service (crash) and possibly execute arbitrary code via a crafted MJPEG-B file."
CVE-2011-3973,"cavsdec.c in libavcodec in FFmpeg before 0.7.4 and 0.8.x before 0.8.3 allows remote attackers to cause a denial of service (incorrect write operation and application crash) via an invalid bitstream in a Chinese AVS video (aka CAVS) file, related to the decode_residual_block, check_for_slice, and cavs_decode_frame functions, a different vulnerability than CVE-2011-3362."
CVE-2011-3974,"Integer signedness error in the decode_residual_inter function in cavsdec.c in libavcodec in FFmpeg before 0.7.4 and 0.8.x before 0.8.3 allows remote attackers to cause a denial of service (incorrect write operation and application crash) via an invalid bitstream in a Chinese AVS video (aka CAVS) file, a different vulnerability than CVE-2011-3362."
CVE-2011-4031,Integer underflow in the asfrtp_parse_packet function in libavformat/rtpdec_asf.c in FFmpeg before 0.8.3 allows remote attackers to execute arbitrary code via a crafted ASF packet.
CVE-2011-4352,"Integer overflow in the vp3_dequant function in the VP3 decoder (vp3.c) in libavcodec in FFmpeg 0.5.x before 0.5.7, 0.6.x before 0.6.4, 0.7.x before 0.7.9, and 0.8.x before 0.8.8; and in Libav 0.5.x before 0.5.6, 0.6.x before 0.6.4, and 0.7.x before 0.7.3 allows remote attackers to cause a denial of service (crash) and possibly execute arbitrary code via a crafted VP3 stream, which triggers a buffer overflow."
CVE-2011-4364,"Buffer overflow in the Sierra VMD decoder in libavcodec in FFmpeg 0.5.x before 0.5.7, 0.6.x before 0.6.4, 0.7.x before 0.7.9 and 0.8.x before 0.8.8; and in Libav 0.5.x before 0.5.6, 0.6.x before 0.6.4, and 0.7.x before 0.7.3 allows remote attackers to cause a denial of service (crash) and possibly execute arbitrary code via a crafted VMD file, related to corrupted streams."
CVE-2011-4579,"The svq1_decode_frame function in the SVQ1 decoder (svq1dec.c) in libavcodec in FFmpeg 0.5.x before 0.5.7, 0.6.x before 0.6.4, 0.7.x before 0.7.9, and 0.8.x before 0.8.8; and in Libav 0.5.x before 0.5.6, 0.6.x before 0.6.4, and 0.7.x before 0.7.3 allows remote attackers to cause a denial of service (memory corruption) via a crafted SVQ1 stream, related to ""dimensions changed."""
CVE-2012-0848,"Heap-based buffer overflow in the ws_snd_decode_frame function in libavcodec/ws-snd1.c in FFmpeg 0.9.1 allows remote attackers to cause a denial of service (application crash) via a crafted media file, related to an incorrect calculation, aka ""wrong samples count."""
CVE-2012-0850,"The sbr_qmf_synthesis function in libavcodec/aacsbr.c in FFmpeg before 0.9.1 allows remote attackers to cause a denial of service (application crash) via a crafted mpg file that triggers memory corruption involving the v_off variable, probably a buffer underflow."
CVE-2012-0851,"The ff_h264_decode_seq_parameter_set function in h264_ps.c in libavcodec in FFmpeg before 0.9.1 and in Libav 0.5.x before 0.5.9, 0.6.x before 0.6.6, 0.7.x before 0.7.6, and 0.8.x before 0.8.3 allows remote attackers to cause a denial of service (application crash) and possibly execute arbitrary code via a crafted H.264 file, related to the chroma_format_idc value."
CVE-2012-0852,"The adpcm_decode_frame function in adpcm.c in libavcodec in FFmpeg before 0.9.1 and in Libav 0.5.x before 0.5.9, 0.6.x before 0.6.6, 0.7.x before 0.7.6, and 0.8.x before 0.8.3 allows remote attackers to cause a denial of service (application crash) and possibly execute arbitrary code via an ADPCM file with the number of channels not equal to two."
CVE-2012-0853,"The decodeTonalComponents function in the Actrac3 codec (atrac3.c) in libavcodec in FFmpeg 0.7.x before 0.7.12, and 0.8.x before 0.8.11; and in Libav 0.5.x before 0.5.9, 0.6.x before 0.6.6, 0.7.x before 0.7.5, and 0.8.x before 0.8.1 allows remote attackers to cause a denial of service (infinite loop and crash) and possibly execute arbitrary code via a large component count in an Atrac 3 file."
CVE-2012-0854,"The dpcm_decode_frame function in libavcodec/dpcm.c in FFmpeg before 0.9.1 does not use the proper pointer after an audio API change, which allows remote attackers to cause a denial of service (application crash) via unspecified vectors, which triggers a heap-based buffer overflow."
CVE-2012-0858,"The Shorten codec (shorten.c) in libavcodec in FFmpeg 0.7.x before 0.7.12 and 0.8.x before 0.8.11, and in Libav 0.5.x before 0.5.9, 0.6.x before 0.6.6, 0.7.x before 0.7.5, and 0.8.x before 0.8.1, allows remote attackers to cause a denial of service (application crash) and possibly execute arbitrary code via a crafted Shorten file, related to an ""invalid free""."
CVE-2012-0859,"The render_line function in the vorbis codec (vorbis.c) in libavcodec in FFmpeg before 0.9.1 allows remote attackers to cause a denial of service (application crash) and possibly execute arbitrary code via a crafted Vorbis file, related to a large multiplier.  NOTE: this vulnerability exists because of an incomplete fix for CVE-2011-3893."
CVE-2012-2772,"Unspecified vulnerability in the ff_rv34_decode_frame function in libavcodec/rv34.c in FFmpeg before 0.11, and Libav 0.7.x before 0.7.7 and 0.8.x before 0.8.4, has unknown impact and attack vectors, related to ""width/height changing with frame threading."""
CVE-2012-2775,"Unspecified vulnerability in the read_var_block_data function in libavcodec/alsdec.c in FFmpeg before 0.11, and Libav 0.7.x before 0.7.7 and 0.8.x before 0.8.4, has unknown impact and attack vectors, related to a large order and an ""out of array write in quant_cof."""
CVE-2012-2776,"Unspecified vulnerability in the decode_cell_data function in libavcodec/indeo3.c in FFmpeg before 0.11 and Libav 0.8.x before 0.8.4 has unknown impact and attack vectors, related to an ""out of picture write."""
CVE-2012-2777,"Unspecified vulnerability in the decode_pic function in libavcodec/cavsdec.c in FFmpeg before 0.11, and Libav 0.7.x before 0.7.7 and 0.8.x before 0.8.4, has unknown impact and attack vectors, related to ""width/height changing in CAVS,"" a different vulnerability than CVE-2012-2784."
CVE-2012-2779,"Unspecified vulnerability in the decode_frame function in libavcodec/indeo5.c in FFmpeg before 0.11, and Libav 0.7.x before 0.7.7 and 0.8.x before 0.8.4, has unknown impact and attack vectors, related to an invalid ""gop header"" and decoding in a ""half initialized context."""
CVE-2012-2783,"Unspecified vulnerability in libavcodec/vp56.c in FFmpeg before 0.11, and Libav 0.7.x before 0.7.7 and 0.8.x before 0.8.5, has unknown impact and attack vectors, related to ""freeing the returned frame."""
CVE-2012-2784,"Unspecified vulnerability in the decode_pic function in libavcodec/cavsdec.c in FFmpeg before 0.11, and Libav 0.7.x before 0.7.7 and 0.8.x before 0.8.4, has unknown impact and attack vectors, related to ""width/height changing in CAVS,"" a different vulnerability than CVE-2012-2777."
CVE-2012-2786,"Unspecified vulnerability in the decode_wdlt function in libavcodec/dfa.c in FFmpeg before 0.11, and Libav 0.7.x before 0.7.7 and 0.8.x before 0.8.4, has unknown impact and attack vectors, related to an ""out of array write."""
CVE-2012-2787,"Unspecified vulnerability in the decode_frame function in libavcodec/indeo4.c in FFmpeg before 0.11 and Libav 0.8.x before 0.8.4 has unknown impact and attack vectors, related to the ""setup width/height."""
CVE-2012-2788,"Unspecified vulnerability in the avi_read_packet function in libavformat/avidec.c in FFmpeg before 0.11, and Libav 0.7.x before 0.7.7 and 0.8.x before 0.8.4, has unknown impact and attack vectors, related to an ""out of array read"" when a ""packet is shrunk."""
CVE-2012-2789,"Unspecified vulnerability in the avi_read_packet function in libavformat/avidec.c in FFmpeg before 0.11, and Libav 0.7.x before 0.7.7 and 0.8.x before 0.8.4, has unknown impact and attack vectors, related to a large number of vector coded coefficients (num_vec_coeffs)."
CVE-2012-2790,"Unspecified vulnerability in the read_var_block_data function in libavcodec/alsdec.c in FFmpeg before 0.11, and Libav 0.7.x before 0.7.7 and 0.8.x before 0.8.4, has unknown impact and attack vectors, related to the ""number of decoded samples in first sub-block in BGMC mode."""
CVE-2012-2791,"Multiple unspecified vulnerabilities in the (1) decode_band_hdr function in indeo4.c and (2) ff_ivi_decode_blocks function in ivi_common.c in libavcodec/ in FFmpeg before 0.11, and Libav 0.7.x before 0.7.7 and 0.8.x before 0.8.5, have unknown impact and attack vectors, related to the ""transform size."""
CVE-2012-2793,"Unspecified vulnerability in the lag_decode_zero_run_line function in libavcodec/lagarith.c in FFmpeg before 0.11, and Libav 0.7.x before 0.7.7 and 0.8.x before 0.8.4, has unknown impact and attack vectors related to ""too many zeros."""
CVE-2012-2794,"Unspecified vulnerability in the decode_mb_info function in libavcodec/indeo5.c in FFmpeg before 0.11, and Libav 0.7.x before 0.7.7 and 0.8.x before 0.8.4, has unknown impact and attack vectors in which the ""allocated tile size ... mismatches parameters."""
CVE-2012-2796,"Unspecified vulnerability in the vc1_decode_frame function in libavcodec/vc1dec.c in FFmpeg before 0.11 and Libav 0.8.x before 0.8.4 has unknown impact and attack vectors, related to inconsistencies in ""coded slice positions and interlacing"" that trigger ""out of array writes."""
CVE-2012-2797,"Unspecified vulnerability in the decode_frame_mp3on4 function in libavcodec/mpegaudiodec.c in FFmpeg before 0.11 and Libav 0.8.x before 0.8.5 has unknown impact and attack vectors related to a calculation that prevents a frame from being ""large enough."""
CVE-2012-2798,"Unspecified vulnerability in the decode_dds1 function in libavcodec/dfa.c in FFmpeg before 0.11, and Libav 0.7.x before 0.7.7 and 0.8.x before 0.8.4, has unknown impact and attack vectors, related to an ""out of array write."""
CVE-2012-2800,"Unspecified vulnerability in the ff_ivi_process_empty_tile function in libavcodec/ivi_common.c in FFmpeg before 0.11, and Libav 0.7.x before 0.7.7 and 0.8.x before 0.8.4, has unknown impact and attack vectors in which the ""tile size ... mismatches parameters"" and triggers ""writing into a too small array."""
CVE-2012-2801,"Unspecified vulnerability in libavcodec/avs.c in FFmpeg before 0.11, and Libav 0.7.x before 0.7.7 and 0.8.x before 0.8.4, has unknown impact and attack vectors, related to dimensions and ""out of array writes."""
CVE-2012-2802,"Unspecified vulnerability in the ac3_decode_frame function in libavcodec/ac3dec.c in FFmpeg before 0.11 and Libav 0.8.x before 0.8.4 has unknown impact and attack vectors, related to the ""number of output channels"" and ""out of array writes."""
CVE-2012-2803,"Double free vulnerability in the mpeg_decode_frame function in libavcodec/mpeg12.c in FFmpeg before 0.11, and Libav 0.7.x before 0.7.7 and 0.8.x before 0.8.5, has unknown impact and attack vectors, related to resetting the data size value."
CVE-2012-2804,"Unspecified vulnerability in libavcodec/indeo3.c in FFmpeg before 0.11 and Libav 0.8.x before 0.8.5 has unknown impact and attack vectors, related to ""reallocation code"" and the luma height and width."
CVE-2012-5116,Use-after-free vulnerability in Google Chrome before 23.0.1271.64 allows remote attackers to cause a denial of service or possibly have unspecified other impact via vectors related to the handling of SVG filters.
CVE-2012-6617,The prepare_sdp_description function in ffserver.c in FFmpeg before 1.0.2 allows remote attackers to cause a denial of service (crash) via vectors related to the rtp format.
CVE-2012-6618,"The av_probe_input_buffer function in libavformat/utils.c in FFmpeg before 1.0.2, when running with certain -probesize values, allows remote attackers to cause a denial of service (crash) via a crafted MP3 file, possibly related to frame size or lack of sufficient ""frames to estimate rate."""
CVE-2013-0844,"Off-by-one error in the adpcm_decode_frame function in libavcodec/adpcm.c in FFmpeg before 1.0.4 allows remote attackers to have an unspecified impact via crafted DK4 data, which triggers an out-of-bounds array access."
CVE-2013-0845,"libavcodec/alsdec.c in FFmpeg before 1.0.4 allows remote attackers to have an unspecified impact via a crafted block length, which triggers an out-of-bounds write."
CVE-2013-0846,"Array index error in the qdm2_decode_super_block function in libavcodec/qdm2.c in FFmpeg before 1.1 allows remote attackers to have an unspecified impact via crafted QDM2 data, which triggers an out-of-bounds array access."
CVE-2013-0848,"The decode_init function in libavcodec/huffyuv.c in FFmpeg before 1.1 allows remote attackers to have an unspecified impact via a crafted width in huffyuv data with the predictor set to median and the colorspace set to YUV422P, which triggers an out-of-bounds array access."
CVE-2013-0849,The roq_decode_init function in libavcodec/roqvideodec.c in FFmpeg before 1.1 allows remote attackers to have an unspecified impact via a crafted (1) width or (2) height dimension that is not a multiple of sixteen in id RoQ video data.
CVE-2013-0850,"The decode_slice_header function in libavcodec/h264.c in FFmpeg before 1.1 allows remote attackers to have an unspecified impact via crafted H.264 data, which triggers an out-of-bounds array access."
CVE-2013-0851,"The decode_frame function in libavcodec/eamad.c in FFmpeg before 1.1 allows remote attackers to have an unspecified impact via crafted Electronic Arts Madcow video data, which triggers an out-of-bounds array access."
CVE-2013-0852,"The parse_picture_segment function in libavcodec/pgssubdec.c in FFmpeg before 1.1 allows remote attackers to have an unspecified impact via crafted RLE data, which triggers an out-of-bounds array access."
CVE-2013-0853,"The wavpack_decode_frame function in libavcodec/wavpack.c in FFmpeg before 1.1 allows remote attackers to have an unspecified impact via crafted WavPack data, which triggers an out-of-bounds array access, possibly due to an off-by-one error."
CVE-2013-0854,The mjpeg_decode_scan_progressive_ac function in libavcodec/mjpegdec.c in FFmpeg before 1.1 allows remote attackers to have an unspecified impact via crafted MJPEG data.
CVE-2013-0855,"Integer overflow in the alac_decode_close function in libavcodec/alac.c in FFmpeg before 1.1 allows remote attackers to have an unspecified impact via a large number of samples per frame in Apple Lossless Audio Codec (ALAC) data, which triggers an out-of-bounds array access."
CVE-2013-0856,"The lpc_prediction function in libavcodec/alac.c in FFmpeg before 1.1 allows remote attackers to have an unspecified impact via crafted Apple Lossless Audio Codec (ALAC) data, related to a large nb_samples value."
CVE-2013-0857,The decode_frame_ilbm function in libavcodec/iff.c in FFmpeg before 1.1 allows remote attackers to have an unspecified impact via a crafted height value in IFF PBM/ILBM bitmap data.
CVE-2013-0858,The atrac3_decode_init function in libavcodec/atrac3.c in FFmpeg before 1.0.4 allows remote attackers to have an unspecified impact via ATRAC3 data with the joint stereo coding mode set and fewer than two channels.
CVE-2013-0860,"The ff_er_frame_end function in libavcodec/error_resilience.c in FFmpeg before 1.0.4 and 1.1.x before 1.1.1 does not properly verify that a frame is fully initialized, which allows remote attackers to trigger a NULL pointer dereference via crafted picture data."
CVE-2013-0865,"The vqa_decode_chunk function in libavcodec/vqavideo.c in FFmpeg before 1.0.4 and 1.1.x before 1.1.2 allows remote attackers to have an unspecified impact via a large (1) cbp0 or (2) cbpz chunk in Westwood Studios VQA Video file, which triggers an out-of-bounds write."
CVE-2013-0866,"The aac_decode_init function in libavcodec/aacdec.c in FFmpeg before 1.0.4 and 1.1.x before 1.1.2 allows remote attackers to have an unspecified impact via a large number of channels in an AAC file, which triggers an out-of-bounds array access."
CVE-2013-0867,"The decode_slice_header function in libavcodec/h264.c in FFmpeg before 1.1.2 does not properly check when the pixel format changes, which allows remote attackers to have unspecified impact via crafted H.264 video data, related to an out-of-bounds array access."
CVE-2013-0868,"libavcodec/huffyuvdec.c in FFmpeg before 1.1.2 allows remote attackers to have an unspecified impact via crafted Huffyuv data, related to an out-of-bounds write and (1) unchecked return codes from the init_vlc function and (2) ""len==0 cases."""
CVE-2013-0869,"The field_end function in libavcodec/h264.c in FFmpeg before 1.1.2 allows remote attackers to have an unspecified impact via crafted H.264 data, related to an SPS and slice mismatch and an out-of-bounds array access."
CVE-2013-0873,"The read_header function in libavcodec/shorten.c in FFmpeg before 1.1.3 allows remote attackers to have an unspecified impact via an invalid channel count, related to ""freeing invalid addresses."""
CVE-2013-0894,"Buffer overflow in the vorbis_parse_setup_hdr_floors function in the Vorbis decoder in vorbisdec.c in libavcodec in FFmpeg through 1.1.3, as used in Google Chrome before 25.0.1364.97 on Windows and Linux and before 25.0.1364.99 on Mac OS X and other products, allows remote attackers to cause a denial of service (divide-by-zero error or out-of-bounds array access) or possibly have unspecified other impact via vectors involving a zero value for a bark map size."
CVE-2013-2277,"The ff_h264_decode_seq_parameter_set function in h264_ps.c in libavcodec in FFmpeg before 1.1.3 does not validate the relationship between luma depth and chroma depth, which allows remote attackers to cause a denial of service (out-of-bounds array access and application crash) or possibly have unspecified other impact via crafted H.264 data."
CVE-2013-2495,"The iff_read_header function in iff.c in libavformat in FFmpeg through 1.1.3 does not properly handle data sizes for Interchange File Format (IFF) data during operations involving a CMAP chunk or a video codec, which allows remote attackers to cause a denial of service (integer overflow, out-of-bounds array access, and application crash) or possibly have unspecified other impact via a crafted header."
CVE-2013-2496,"The msrle_decode_8_16_24_32 function in msrledec.c in libavcodec in FFmpeg through 1.1.3 does not properly determine certain end pointers, which allows remote attackers to cause a denial of service (out-of-bounds array access and application crash) or possibly have unspecified other impact via crafted Microsoft RLE data."
CVE-2013-3670,"The rle_unpack function in vmdav.c in libavcodec in FFmpeg git 20130328 through 20130501 does not properly use the bytestream2 API, which allows remote attackers to cause a denial of service (out-of-bounds array access and application crash) via crafted RLE data.  NOTE: the vendor has listed this as an issue fixed in 1.2.1, but the issue is actually in new code that was not shipped with the 1.2.1 release or any earlier release."
CVE-2013-3672,"The mm_decode_inter function in mmvideo.c in libavcodec in FFmpeg before 1.2.1 does not validate the relationship between a horizontal coordinate and a width value, which allows remote attackers to cause a denial of service (out-of-bounds array access and application crash) via crafted American Laser Games (ALG) MM Video data."
CVE-2013-3674,"The cdg_decode_frame function in cdgraphics.c in libavcodec in FFmpeg before 1.2.1 does not validate the presence of non-header data in a buffer, which allows remote attackers to cause a denial of service (out-of-bounds array access and application crash) via crafted CD Graphics Video data."
CVE-2013-4358,libavcodec/h264.c in FFmpeg before 0.11.4 allows remote attackers to cause a denial of service (crash) via vectors related to alternating bit depths in H.264 data.
CVE-2013-7009,"The rpza_decode_stream function in libavcodec/rpza.c in FFmpeg before 2.1 does not properly maintain a pointer to pixel data, which allows remote attackers to cause a denial of service (out-of-bounds array access) or possibly have unspecified other impact via crafted Apple RPZA data."
CVE-2013-7010,Multiple integer signedness errors in libavcodec/dsputil.c in FFmpeg before 2.1 allow remote attackers to cause a denial of service (out-of-bounds array access) or possibly have unspecified other impact via crafted data.
CVE-2013-7011,"The read_header function in libavcodec/ffv1dec.c in FFmpeg before 2.1 does not prevent changes to global parameters, which allows remote attackers to cause a denial of service (out-of-bounds array access) or possibly have unspecified other impact via crafted FFV1 data."
CVE-2013-7014,Integer signedness error in the add_bytes_l2_c function in libavcodec/pngdsp.c in FFmpeg before 2.1 allows remote attackers to cause a denial of service (out-of-bounds array access) or possibly have unspecified other impact via crafted PNG data.
CVE-2013-7015,"The flashsv_decode_frame function in libavcodec/flashsv.c in FFmpeg before 2.1 does not properly validate a certain height value, which allows remote attackers to cause a denial of service (out-of-bounds array access) or possibly have unspecified other impact via crafted Flash Screen Video data."
